{
  "authority": "CAA (FAA)",
  "part": "CAR 3",
  "section": "221",
  "current_subpart": "Vertical Tail Surfaces",
  "canonical_title": "Outboard fins",
  "subject_group": "Strength Requirements",
  "amendments": [
    {
      "designator": "CAR3-0",
      "subpart_at_time": "Vertical Tail Surfaces",
      "title_at_amendment": "Outboard fins.",
      "text": "When\nboard fins are carried on the horizontal\ntail surface. the tail surfaces shall be\ndesigned for the maximum horizontal\nsurface load in combination with the\ncorresponding loads induced on the ver-\ntical surfaces by end plate effects. Such\ninduced efiects need not be combined\nwith other vertical surface loads. When\noutboard fins extend above and below\nthe horizontal surface, the critical vert!\u00b7\ncal surface loading Iload per unit area)\nas determined by \u00a7\u00a7 3.219 and 3.220\nshall be applied:\n(a) To the portion of the vertical sur-\nfaces above the horizontal surface, ami\n80 percent of that loading applied to the\nportion below the horizontal surface.\n(b) To the portion of the vertical sur-\nfaces below the horizontal surface, and\n80 percent of that loading applied to the\nportion above the horizontal surface.\nAILERONS. WINO FLAPS. TABS. ETC.",
      "federal_register_cite": "",
      "source_url": null
    }
  ]
}
