{
  "authority": "CAA (FAA)",
  "part": "CAR 3",
  "section": "61",
  "current_subpart": "General",
  "canonical_title": "Policy re proof of compliance",
  "subject_group": "Flight Requirements",
  "amendments": [
    {
      "designator": "CAR3-0",
      "subpart_at_time": "General",
      "title_at_amendment": "Policy re proof of compliance.",
      "text": "Compliance with the requirements speci-\nfied in this subpart governing functional\ncharacteristics shall be demonstrated by\nsuitable flight or other tests conducted\nupon an airplane of the type, or by cal-\nculations based upon the test data re-\nferred to above, provided that the results\nso obtained are substantially equal in ac-\ncuracy to the results of direct testing.\nCompliance with each requirement must\nbe provided at the critical combination\nof airplane weight and center of gravity\nposition within the range of either for\nwhith certification is desired. Such\ncompliance must be demonstrated by\nsystematic investigation of all probable\nweight and center of gravity combina-\ntions or must be reasonably inferable\nfrom such as are investigated.\n\u00a73.62 Flight test pilot. The applicant\nshall provide a person holding an ap-\npropriate pilot certificate to make the\nflight tests, but a designated representa-\ntive of the Administrator may pilot the\nairplane insofar as that may be necessary\nfor the determination of complance\nwith the airworthiness requirements.\n\u00a73.63 Noncompliance with test re-\nquirements. Official type tests will be\ndiscontinued until corrective measures\nhave been taken by the applicant when\neither:\n(a) The applicant\u2019s test pilot is unable\nor unwilling to conduct any of the re-\nquired flight tests; or\n(b) Items of noncompliance with re-\nquirements are found which may render\nadditional test data meaningless or are\nof such nature as to make further test-\ning unduly hazardous.\n\u00a73.64 Emergency egress. Adequate\nprovisions shall be made for emergency\negress and use of parachutes by members\nof the crew during the flight tests.\n\u00a73.65 Report. The applicant shall\nsubmit to the representative of the Ad-\nministrator a report eovering all compu-\ntations and tests required in connection\nwith calibration of insiruments used for\ntest purposes and correction of test re-\nsults to standard atmospheric conditions.\nThe representative of the Administrator\nwill conduct any flight tests which he\nfinds to be necessary in order to check\nthe calibration and correction report.\nWEIGHT RANGE AND CENTER OF CIRAVITY\n\u00a73.71 Weight and balance. (a) There\nBhall be established, as a part of the type\ninspection, ranges of weight and center\nof gravity within which the airplane may\nbe safely operated.\n(b) When low fuel adversely affects\nbalance or stability, the airplane shal} be\nso tested as to simulate the condition\nexisting when the amount of usable fuel\non board does not exceed 1 gallon for\nevery 12 maximum continuous horse-\npower of the engine or engines installed.\n$3.72 Use of ballast. Removable\nbaliast may be used to enable airplanes\nto comply with the flight requirements\nin accordance with the following provi-\nsions:\n(a) The place or places for carrying\nballast shall be properly designed, in-\nStalled, and plainly marked as specified\nin \u00a7 3.766.\n(b) The Airplane Flight Manual shall\ninclude instructions regarding the proper\ndisposition of the removable ballast un-\nder all loading conditions for which such\nballast is necessary. as specified in\n\u00a7\u00a7 3.766 and 3.777.\n83.73 Empty weight. The empty\nweight and corresponding center of\nfravity location shal! include all fixed\nballast, the unusable fuel supply (see\n\u00a7 3.437), undrainable oil, full engine\ncOolant, and hydraulic fluid. The\nweight and location of items of equip-\nMent installed when the airplane is\nweighed shall be noted in the Airplane\nFlight Manual.\n83.74 Mazrimum weight. {a} The\nMaximum weight shall not exceed any\nof the following:\n(1) The weight selected by the appli-\ncant.\n(2) The design weight for which the\nstructure has been proven, except as\nprovided in \u00a7 3.242 for multiengine air-\nPlanes.\n(3) The maximum weight at which\ncompliance with all of the applicable\nflight requirements has been demon-\nstrated.\n(b) The maximum weight shall not\nbe less than the weights under the load-\ning conditions prescribed in subpara-\ngraphs (1) and (2) of this paragraph\nassuming that the weight of the occu-\npant in each of the seats is 170 pounds\nfor the normal category and 190 pounds\nfor the utility and acrobatic categories,\nunless piacarded otherwise.\n(1) All seats occupied, oil to full tank\ncapacity, and at least a fuel supply for\none-half hour operation at rated maxi-\nmum continuous power.\n(2) Fuel and oi] to full tank capacities,\nand minimum crew.",
      "federal_register_cite": "",
      "source_url": null
    }
  ]
}
