{
  "authority": "FAA",
  "part": "23",
  "section": "397",
  "current_subpart": "Structure",
  "canonical_title": "Limit pilot forces.",
  "amendments": [
    {
      "designator": "23-7",
      "subpart_at_time": "Structure",
      "title_at_amendment": "Limit pilot forces.",
      "text": "[(a) In the control surface flight loading condition, the airloads on movable surfaces and the corresponding deflections need not exceed those that would result in flight from the application of any pilot force within the ranges specified in paragraph (b) of this section. In applying this criterion, the effects of control system boost and servo-mechanisms, and the effects of tabs must be considered. The automatic pilot effort must be used for design if it alone can produce higher control surface loads than the human pilot. (b) The limit pilot forces are as follows:] ControlMaximum forces for design weight, W equal to or less than 5,000 pounds1Minimum forces2 Aileron: Stick----------------------------- 67 pounds------------------------ 40 pounds. Wheel3-------------------------- [50 pounds4--------------------- 40 pounds4.] Elevator: Stick------------------------------ 167 pounds---------------------- 100 pounds. Wheel---------------------------- 200 pounds---------------------- 100 pounds. Rudder-------------------------- 200 pounds---------------------- 130 pounds. 1 For design weight (W) more than 5,000 pounds, the specified maximum values must be increased linearly with weight to 1.18 times the specified values at a design weight of 12,500 pounds. 2 If the design of any individual set of control systems or surfaces makes these specified minimum forces inapplicable, values corresponding to the pertinent hinge moments obtained under Sec. 23.415, but not less than 0.6 of the specified minimum forces, may be used. 3 The critical parts of the aileron control system must also be designed for a single tangential force with a limit value of 1.25 times the couple force determined from the above criteria. [4 The force must be applied simultaneously to opposite sides of the wheel and in opposite directions.] 67-14; Issued on 04/05/67. --> Link to eCFR --> NPRM ACTIONS: &nbsp; Notice of Proposed Rulemaking. Notice No. 67-14; Issued on 04/05/67. 8083; Issued on 08/01/69. --> Link to eCFR --> FINAL RULE ACTIONS: &nbsp; Final Rule. Docket No. 8083; Issued on 08/01/69.",
      "federal_register_cite": "34 FR 13089",
      "source_url": "https://drs.faa.gov/browse/excelExternalWindow/0A6F3A1B9C55237685256687006CD874.0001"
    }
  ],
  "subject_group": "Control Surface and System Loads"
}
