{
  "authority": "FAA",
  "part": "23",
  "section": "781",
  "current_subpart": "Design and Construction",
  "canonical_title": "Cockpit control knob shape.",
  "amendments": [
    {
      "designator": "23-0",
      "subpart_at_time": "Design and Construction",
      "title_at_amendment": "Cockpit control knob shape.",
      "text": "Cockpit control knobs must conform to the general shapes (but not necessarily the exact sizes or specific proportions) in the following figure: Flap Control Knob\nLanding Gear Control Knob",
      "federal_register_cite": "29 FR 17955",
      "source_url": "https://drs.faa.gov/browse/excelExternalWindow/9EEA61EF6E58B1AD85256687006E6E39.0001",
      "actions": [
        {
          "type": "nprm",
          "reference": "64-17",
          "issued_on": "2064-03-25",
          "source_url": null,
          "notes": null
        },
        {
          "type": "final_rule",
          "reference": "4080",
          "issued_on": "2064-09-28",
          "source_url": null,
          "notes": null
        }
      ]
    }
  ],
  "subject_group": "Personnel and Cargo Accommodations"
}
