{
  "authority": "FAA",
  "part": "23",
  "section": "1203",
  "current_subpart": "Powerplant",
  "canonical_title": "Fire detector system.",
  "amendments": [
    {
      "designator": "23-34",
      "subpart_at_time": "Powerplant",
      "title_at_amendment": "Fire detector system.",
      "text": "For multiengine turbine powered airplanes, multiengine reciprocating engine powered airplanes incorporating turbo-superchargers, and [all commuter category airplanes, the following apply:] (a) There must be a means which ensures the prompt detection of a fire in an engine compartment. (b) Each fire detector must be constructed and installed to withstand the vibration, inertia, and other loads to which it may be subjected in operation. (c) No fire detector may be affected by any oil, water, other fluids, or fumes that might be present. (d) There must be means to allow the crew to check, in flight, the functioning of each fire detector electric circuit. (e) Wiring and other components of each fire detector system in an engine compartment must be at least fire resistant. 83-17; Issued on 09/23/83. --> Link to eCFR --> NPRM ACTIONS: &nbsp; Notice of Proposed Rulemaking. Notice No. 83-17; Issued on 09/23/83. 23516; Issued on 01/08/87. --> Link to eCFR --> FINAL RULE ACTIONS: &nbsp; Final Rule. Docket No. 23516; Issued on 01/08/87.",
      "federal_register_cite": "52 FR 1833",
      "source_url": "https://drs.faa.gov/browse/excelExternalWindow/4753EC2E5345FC458525668700706680.0001"
    }
  ],
  "subject_group": "Powerplant Fire Protection"
}
