{
  "authority": "CAA (FAA)",
  "part": "CAR 3",
  "section": "561",
  "current_subpart": "Oil System",
  "canonical_title": "Oil system",
  "subject_group": "Powerplant Installations \u2013 Reciprocating Engines",
  "amendments": [
    {
      "designator": "CAR3-0",
      "subpart_at_time": "Oil System",
      "title_at_amendment": "Oil system.",
      "text": "Each engine shan\nbe provided with an independent oU sys-\ntem capable of supplying the engine with\nan ample quantity of all at a tempera\u00b7\nture not exceeding the maximum whJcb\nhas been established as safe for continu\u00b7\nous operation. The usable aU tank ca-\npacity shall not be less than the product\nof the endurance of the airplane under\ncritical operating conditions and the\nmaximum oil consumption of the engine\nunder the same conditions, pl\"W3 a sUit-\nable margin to assure adequate system\ncirculation and COOling.",
      "federal_register_cite": "",
      "source_url": null
    }
  ]
}
