{
  "authority": "FAA",
  "part": "23",
  "section": "995",
  "current_subpart": "Powerplant",
  "canonical_title": "Fuel valves and controls.",
  "amendments": [
    {
      "designator": "23-29",
      "subpart_at_time": "Powerplant",
      "title_at_amendment": "Fuel valves and controls.",
      "text": "(a) There must be a means to allow appropriate flight crew members to rapidly shut off, in flight, the fuel to each engine individually. (b) No shutoff valve may be on the engine side of any firewall. In addition, there must be means to-- (1) Guard against inadvertent operation of each shutoff valve; and (2) Allow appropriate flight crew members to reopen each valve rapidly after it has been closed. (c) Each valve and fuel system control must be supported so that loads resulting from its operation or from accelerated flight conditions are not transmitted to the lines connected to the valve. (d) Each valve and fuel system control must be installed so that gravity and vibration will not affect the selected position. (e) Each fuel valve handle and its connections to the valve mechanism must have design features that minimize the possibility of incorrect installation. (f) Each check valve must be constructed, or otherwise incorporate provisions, to preclude incorrect assembly or connection of the valve. [(g) Fuel tank selector valves must-- (1) Require a separate and distinct action to place the selector in the &quot;OFF&quot; position; and (2) Have the tank selector positions located in such a manner that it is impossible for the selector to pass through the &quot;OFF&quot; position when changing from one tank to another.]",
      "federal_register_cite": "49 FR 6847",
      "source_url": "https://drs.faa.gov/browse/excelExternalWindow/63172E20DDD44A8285256687007052B3.0001",
      "actions": [
        {
          "type": "nprm",
          "reference": "80-21",
          "issued_on": "1980-11-10",
          "source_url": null,
          "notes": null
        },
        {
          "type": "final_rule",
          "reference": "16919",
          "issued_on": "1983-12-16",
          "source_url": null,
          "notes": null
        }
      ]
    }
  ],
  "subject_group": "Fuel System Components"
}
