{
  "authority": "CAA (FAA)",
  "part": "CAR 3",
  "section": "265",
  "current_subpart": "Water Loads",
  "canonical_title": "General",
  "subject_group": "Strength Requirements",
  "amendments": [
    {
      "designator": "CAR3-0",
      "subpart_at_time": "Water Loads",
      "title_at_amendment": "Water load conditions.",
      "text": "The\nstructure of boat and float type sea-\nplanes shall be designed for water loads\ndeveloped during take-off and landlng\nwith the seaplane 1n any attitude likely\nto occur in normal operation at appro-\npriate forward and sinking velocities\nunder the most severe sea conditions\nlikely to be encountered. Unless a more\nrational analysis of the water loads is\nperformed, the requirements of \u00a7\u00a7 4b.251\nthrough 4b.258 of this subchapter shall\napply.\nSUBPART D-DESIGN AND CONSTRUCTION\nGENERAL",
      "federal_register_cite": "",
      "source_url": null
    }
  ]
}
