{
  "authority": "FAA",
  "part": "23",
  "section": "73",
  "current_subpart": "Flight",
  "canonical_title": "(Reference landing approach speed.)",
  "amendments": [
    {
      "designator": "23-50",
      "subpart_at_time": "Flight",
      "title_at_amendment": "(Reference landing approach speed.)",
      "text": "[(a) For normal, utility, and acrobatic category reciprocating engine-powered airplanes of 6,000 pounds or less maximum weight, the reference landing approach speed, VREF, must not be less than the greater of VMC, determined in Sec. 23.149(b) with the wing flaps in the most extended takeoff position, and 1.3 . (b) For normal, utility, and acrobatic category reciprocating engine-powered airplanes of more than 6,000 pounds maximum weight, and turbine engine-powered airplanes in the normal, utility, and acrobatic category, the reference landing approach speed, VREF, must not be less than the greater of VMC, determined in Sec. 23.149(c), and 1.3 . (c) For commuter category airplanes, the reference landing approach speed, VREF, must not be less than the greater of 1.05 VMC, determined in Sec. 23.149(c), and 1.3 .]",
      "federal_register_cite": "76 FR 75754",
      "source_url": "https://drs.faa.gov/browse/excelExternalWindow/8B38AEA79ED44EAC85256687006BCC6F.0001",
      "actions": [
        {
          "type": "nprm",
          "reference": "94-22",
          "issued_on": "1994-07-19",
          "source_url": null,
          "notes": null
        },
        {
          "type": "final_rule",
          "reference": "27807",
          "issued_on": "1996-01-29",
          "source_url": null,
          "notes": null
        }
      ]
    }
  ],
  "subject_group": "Performance"
}
