{
  "authority": "FAA",
  "part": "23",
  "section": "655",
  "current_subpart": "Design and Construction",
  "canonical_title": "Installation.",
  "amendments": [
    {
      "designator": "23-45",
      "subpart_at_time": "Design and Construction",
      "title_at_amendment": "Installation.",
      "text": "[(a) Movable surfaces must be installed so that there is no interference between any surfaces, their bracing, or adjacent fixed structure, when one surface is held in its most critical clearance positions and the others are operated through their full movement.] (b) If an adjustable stabilizer is used, it must have stops that will limit its range of travel to that allowing safe flight and landing. 90-18; Issued on 06/15/90. --> Link to eCFR --> NPRM ACTIONS: &nbsp; Notice of Proposed Rulemaking. Notice No. 90-18; Issued on 06/15/90. 26269; Issued on 07/28/93. --> Link to eCFR --> FINAL RULE ACTIONS: &nbsp; Final Rule. Docket No. 26269; Issued on 07/28/93.",
      "federal_register_cite": "58 FR 42164",
      "source_url": "https://drs.faa.gov/browse/excelExternalWindow/EDAEA1F2B7D6EEAA85256687006DCB3E.0001"
    }
  ],
  "subject_group": "Control Surfaces"
}
