{
  "authority": "FAA",
  "part": "23",
  "section": "1587",
  "current_subpart": "Operating Limitations and Information",
  "canonical_title": "Performance information.",
  "amendments": [
    {
      "designator": "23-45",
      "subpart_at_time": "Operating Limitations and Information",
      "title_at_amendment": "Performance information.",
      "text": "[The following information must be furnished: (a) For normal, utility, and acrobatic category airplanes-- (1) The takeoff distance determined under Sec. 23.51 and the kind of runway surface used in the tests. (2) The climb gradient determined under Secs. 23.65 and 23.77, with the associated airspeed, power, and the airplane configuration. (3) The landing distance determined under Sec. 23.75. (4) The one engine inoperative en route climb/descent gradients determined under Sec. 23.67 for multiengine airplanes. (5) The calculated approximate effect on takeoff distance, landing distance, and climb performance for variations in-- (i) Altitude from sea level to 10,000 feet in a standard atmosphere and cruise configuration; and (ii) Temperature, at those altitudes from 60\ufffdF below standard to 40\ufffdF above standard. (b) For skiplanes, a statement of the approximate reduction in climb performance may be used instead of complete new data for skiplane configuration if-- (1) The landing gear is fixed in both the landplane and skiplane configurations; (2) The climb performance is not critical; and (3) The climb reduction in the skiplane configuration does not exceed 50 feet per minute. (c) For each airplane: (1) Any loss of altitude more than 100 feet, or any pitch more than 30 degrees below level flight attitude, occurring during the recovery part of maneuvers prescribed in Secs. 23.201(c) and 23.205, if applicable. (2) The stalling speed, , at maximum weight. (3) The stalling speed, , at maximum weight and with landing gear and wing flaps retracted and the effect upon this stalling speed of angles of bank up to 60 degrees. (4) The speed used in showing compliance with the cooling and climb requirements of Secs. 23.1041 through 23.1047 if this speed is greater than the best rate of climb with one engine inoperative for multiengine airplanes and the maximum atmospheric temperature at which compliance with the cooling requirements has been shown.] (d) Commuter category airplanes. In addition, for commuter category airplanes, the Airplane Flight Manual must contain at least the following performance information: (1) Sufficient information so that the takeoff weight limits specified in Sec. 23.1583 can be determined for all temperatures and altitudes within the operational limitations selected by the applicant; (2) The conditions under which the performance information was obtained including the airspeed at the 50 foot height used to determine the landing distance as required by Sec. 23.75; (3) The performance information (determined by extrapolation and computed for the range of weights between the maximum landing and maximum takeoff weights) for-- (i) Climb in the landing configuration as determined by Sec. 23.77; and (ii) Landing distance as determined by Sec. 23.75; (4) Procedures information established in accordance with the limitations and other information for safe operation of the airplane in the form of recommended procedures; (5) An explanation of significant or unusual flight and ground handling characteristics of the airplane; and (6) Airspeed, as calibrated airspeed, corresponding to those established while showing compliance with Sec. 23.53, takeoff speeds. The calibrated airspeed may be shown in units of indicated airspeed, and identified as indicated airspeed, provided that all pressure sensing and instrumentation errors, including the indicator, are accounted for in the flight manual data. 90-18; Issued on 06/15/90. --> Link to eCFR --> NPRM ACTIONS: &nbsp; Notice of Proposed Rulemaking. Notice No. 90-18; Issued on 06/15/90. 26269; Issued on 07/28/93. --> Link to eCFR --> FINAL RULE ACTIONS: &nbsp; Final Rule. Docket No. 26269; Issued on 07/28/93.",
      "federal_register_cite": "61 FR 5194",
      "source_url": "https://drs.faa.gov/browse/excelExternalWindow/D76447AEDF1CEA1D8525668700723F90.0001"
    }
  ],
  "subject_group": "Airplane Flight Manual and Approved Manual Material"
}
