{
  "authority": "FAA",
  "part": "23",
  "section": "23",
  "current_subpart": "Flight",
  "canonical_title": "Load distribution limits.",
  "amendments": [
    {
      "designator": "23-45",
      "subpart_at_time": "Flight",
      "title_at_amendment": "Load distribution limits.",
      "text": "[(a) Ranges of weights and centers of gravity within which the airplane may be safely operated must be established. If a weight and center of gravity combination is allowable only within certain lateral load distribution limits that could be inadvertently exceeded, these limits must be established for the corresponding weight and center of gravity combinations. (b) The load distribution limits may not exceed any of the following: (1) The selected limits; (2) The limits at which the structure is proven; or (3) The limits at which compliance with each applicable flight requirement of this subpart is shown.]",
      "federal_register_cite": "58 FR 42156",
      "source_url": "https://drs.faa.gov/browse/excelExternalWindow/D08498EB59CB49BA85256687006BB500.0001",
      "actions": [
        {
          "type": "nprm",
          "reference": "90-18",
          "issued_on": "1990-06-15",
          "source_url": null,
          "notes": null
        },
        {
          "type": "final_rule",
          "reference": "26269",
          "issued_on": "1993-07-28",
          "source_url": null,
          "notes": null
        }
      ]
    }
  ],
  "subject_group": "General"
}
