{
  "authority": "FAA",
  "part": "23",
  "section": "729",
  "current_subpart": "Design and Construction",
  "canonical_title": "Retracting mechanism.",
  "amendments": [
    {
      "designator": "23-0",
      "subpart_at_time": "Design and Construction",
      "title_at_amendment": "Retracting mechanism.",
      "text": "(a) General. For airplanes with retractable landing gear, the following apply: (1) Each landing gear retracting mechanism and its supporting structure must be designed for maximum flight load factors with the gear retracted and must be designed for the combination of friction, inertia, brake torque, and air loads, occurring during retraction at any airspeed up to 1.6 with flaps retracted, and for any load factor up to those specified in Sec. 23.345 for the flaps-extended condition. (2) The landing gear and retracting mechanism, including the wheel well doors, must withstand flight loads with the landing gear extended at any speed up to at least 1.6 with the flaps retracted. (b) Landing gear lock. There must be positive means (other than the use of hydraulic pressure) to keep the landing gear extended. (c) Emergency operation. A landplane without manually operated landing gear must have an auxiliary means of extending the gear. (d) Operation test. The proper functioning of the retracting mechanism must be shown by operation tests. (e) Position indicator and warning device. There must be means to indicate to the pilot when the wheels are secured in the extreme positions. In addition, landplanes must have an aural or equally effective warning device that functions continuously, when one or more throttles are closed, until the gear is down and locked. A throttle stop is not an acceptable alternative to an aural landing gear warning device.",
      "federal_register_cite": "29 FR 17955",
      "source_url": "https://drs.faa.gov/browse/excelExternalWindow/773DE0D2B8B1ADCD85256687006E606A.0001",
      "actions": [
        {
          "type": "nprm",
          "reference": "64-17",
          "issued_on": "2064-03-25",
          "source_url": null,
          "notes": null
        },
        {
          "type": "final_rule",
          "reference": "4080",
          "issued_on": "2064-09-28",
          "source_url": null,
          "notes": null
        }
      ]
    }
  ],
  "subject_group": "Landing Gear"
}
