{
  "authority": "FAA",
  "part": "23",
  "section": "75",
  "current_subpart": "Flight",
  "canonical_title": "Landing.",
  "amendments": [
    {
      "designator": "23-42",
      "subpart_at_time": "Flight",
      "title_at_amendment": "Landing.",
      "text": "For airplanes (except skiplanes for which landplane landing data have been determined under this section and furnished in the Airplane Flight Manual), the horizontal distance necessary to land and come to a complete stop (or to a speed of approximately 3 knots for water landings of seaplanes and amphibians) from a point 50 feet above the landing surface must be determined as follows: [(a) A steady approach with a calibrated airspeed of not less than 1.3 must be maintained down to the 50-foot height and-- (1) The steady approach must be at a gradient of descent not greater than 5.2 percent (3 degrees) down to the 50-foot height. (2) In addition, an applicant may demonstrate by tests that a maximum steady approach gradient steeper than 5.2 percent, down to the 50-foot height , is safe. The gradient must be established as an operating limitation and the information necessary to display the gradient must be available to the pilot by an appropriate instrument. (b) The landing may not require more than average piloting skill when landing during the atmospheric conditions expected to be encountered in service, including crosswinds and turbulence.] (c) The landing must be made without excessive vertical acceleration or tendency to bounce, nose over, ground loop, porpoise, or water loop. (d) It must be shown that a safe transition to the balked landing conditions of Sec. 23.77 can be made from the conditions that exist at the 50-foot height. (e) The pressures on the wheel braking system may not exceed those specified by the brake manufacturer. (f) Means other than wheel brakes may be used if that means-- (1) Is safe and reliable; (2) Is used so that consistent results can be expected in service; and [(3) Is such that no more than average skill is required to control the airplane. (g) If any device is used that depends on the operation of any engine, and the landing distance would be increased when a landing is made with that engine inoperative, the landing distance must be determined with that engine inoperative unless the use of other compensating means will result in a landing distance not more than that with each engine operating. (h) In addition, for commuter category airplanes, the following apply:] (1) The landing distance must be determined for standard temperatures at each weight, altitude, and wind condition within the operational limits established by the applicant; (2) A steady gliding approach, or a steady approach at a gradient of descent not greater than 5.2 percent (3\ufffd), at a calibrated airspeed not less than 1.3 must be maintained down to the 50-foot height; and (3) The landing distance data must include correction factors for not more than 50 percent of the nominal wind components along the landing path opposite to the direction of landing and not less than 150 percent of the nominal wind components along the landing path in the direction of landing.",
      "federal_register_cite": "56 FR 351",
      "source_url": "https://drs.faa.gov/browse/excelExternalWindow/9D1D468373ABB85A85256687006BB3FB.0001",
      "actions": [
        {
          "type": "nprm",
          "reference": "89-5",
          "issued_on": "1989-02-23",
          "source_url": null,
          "notes": null
        },
        {
          "type": "final_rule",
          "reference": "25811",
          "issued_on": "1990-12-21",
          "source_url": null,
          "notes": null
        }
      ]
    }
  ],
  "subject_group": "Performance"
}
