{
  "authority": "CAA (FAA)",
  "part": "CAR 3",
  "section": "681",
  "current_subpart": "Electrical Systems and Equipment",
  "canonical_title": "Installation",
  "subject_group": "Equipment",
  "amendments": [
    {
      "designator": "CAR3-0",
      "subpart_at_time": "Electrical Systems and Equipment",
      "title_at_amendment": "Installation.",
      "text": "(a) Electrical\nsystems in airplanes shall be free from\nhazards in themselves, in their method of\noperation. and in their effects on other\nparts of the airplane. Electrical equip-\nment shall be of a type and design ade-\nquate for the use intended. Electrical\nsystems shall be installed in a man_\nner that they are suitably protected from\nfuel, oil. water, other detrim.ental sub..\nstances, and mechanical damage.\n(b) Items of electrical equipment, re-\nquired for a specific type of operation are\nlisted in other pertinent }:larts of this\nsubchapter.\nBATTERIES",
      "federal_register_cite": "",
      "source_url": null
    }
  ]
}
