{
  "authority": "CAA (FAA)",
  "part": "CAR 3",
  "section": "728",
  "current_subpart": "Hydraulic Systems",
  "canonical_title": "Accumulators",
  "subject_group": "Equipment",
  "amendments": [
    {
      "designator": "CAR3-0",
      "subpart_at_time": "Hydraulic Systems",
      "title_at_amendment": "Accumulators.",
      "text": "Hydraulic ac-\ncumulators or pressurized reservoirs\nshall not be installed on the engine side\nof the fire wall. except when they form\nan integral part of the engine ;>ro-\npeller.\nSUBPART LIMITATIONS AND\nINFORMATION",
      "federal_register_cite": "",
      "source_url": null
    }
  ]
}
