{
  "authority": "FAA",
  "part": "23",
  "section": "1419",
  "current_subpart": "Equipment",
  "canonical_title": "Ice protection.",
  "amendments": [
    {
      "designator": "23-14",
      "subpart_at_time": "Equipment",
      "title_at_amendment": "Ice protection.",
      "text": "[If certification with ice protection provisions is desired, compliance with the following requirements must be shown: (a) The recommended procedures for the use of the ice protection equipment must be set forth in the Airplane Flight Manual or in approved manual material. (b) An analysis must be performed to establish, on the basis of the airplane's operational needs, the adequacy of the ice protection system for the various components of the airplane. In addition, tests of the ice protection system must be conducted to demonstrate that the airplane is capable of operating safely in continuous maximum and intermittent maximum icing conditions as described in Appendix C of Part 25 of this chapter. (c) Compliance with all or portions of this section may be accomplished by reference, where applicable because of similarity of the designs, to analysis and tests performed for the type certification of a type certificated aircraft. (d) When monitoring of the external surfaces of the airplane by the flight crew is required for proper operation of the ice protection equipment, external lighting must be provided which is adequate to enable the monitoring to be done at night.] 71-13; Issued on 04/27/71. --> Link to eCFR --> NPRM ACTIONS: &nbsp; Notice of Proposed Rulemaking. Notice No. 71-13; Issued on 04/27/71. 11011; Issued on 11/07/73. --> Link to eCFR --> FINAL RULE ACTIONS: &nbsp; Final Rule. Docket No. 11011; Issued on 11/07/73.",
      "federal_register_cite": "58 FR 18977",
      "source_url": "https://drs.faa.gov/browse/excelExternalWindow/34F3C0A02BCDAB8E852566870071D538.0001"
    }
  ],
  "subject_group": "Safety Equipment"
}
