{
  "authority": "CAA (FAA)",
  "part": "CAR 3",
  "section": "296",
  "current_subpart": "General",
  "canonical_title": "Inspection provisions",
  "subject_group": "Design and Construction",
  "amendments": [
    {
      "designator": "CAR3-0",
      "subpart_at_time": "General",
      "title_at_amendment": "Inspection prOvisions, Ade-.",
      "text": "quate means shall be provided to permitI\nthe close examination of such parts of\nthe airplane as require periodic inspec-\ntion, adjustments for proper alignment\nand functioning, and lubrication of\ning parts.\nSTRUCTURAL PARTS",
      "federal_register_cite": "",
      "source_url": null
    }
  ]
}
