{
  "authority": "CAA (FAA)",
  "part": "CAR 3",
  "section": "651",
  "current_subpart": "General",
  "canonical_title": "General",
  "subject_group": "Equipment",
  "amendments": [
    {
      "designator": "CAR3-0",
      "subpart_at_time": "General",
      "title_at_amendment": "General.",
      "text": "The equipment spec-\nified in \u00a7 3.655 shall be the mi.nimum in-\nstalled when the airplane is submitted\nto determine its compliance with the\nairworthiness requirements. Such addi-\ntional equipment as is necessary for a\nspecifiC type of operation Is specified in\nother pertinent Parts of this subchapter.\nbut. where necessrry, Its installation and\nthat of the items mentioned in \u00a7 3.655 is\ncovered by this part.",
      "federal_register_cite": "",
      "source_url": null
    }
  ]
}
