{
  "authority": "CAA (FAA)",
  "part": "CAR 3",
  "section": "766",
  "current_subpart": "Miscellaneous",
  "canonical_title": "Baggage compartments, ballast location, and special seat loading limitations",
  "subject_group": "Operating Limitations and Information",
  "amendments": [
    {
      "designator": "CAR3-0",
      "subpart_at_time": "Miscellaneous",
      "title_at_amendment": "Baggage compartments.",
      "text": "bal-\nlast location, and special seat loading\nlimitations. (a) Each baggage or cargo\ncompartment and ballast location shall\nbear a placard which states the maXi-\nInurn allowable weight of contents and.\n1! apPlicable, any special limitation of\ncontents due to loading requirements.\netc.\n(b) When the maximum permissible\nweight to be carried in a seat is less than\n170 pounds (see \u00a7 3.74), a placard shall\nbe permanently attached t. the seat\nstructure which states the maximum\naIlowable weight of occupants to be car-\nried.",
      "federal_register_cite": "",
      "source_url": null
    }
  ]
}
