{
  "authority": "FAA",
  "part": "23",
  "section": "965",
  "current_subpart": "Powerplant",
  "canonical_title": "Fuel tank tests.",
  "amendments": [
    {
      "designator": "23-51",
      "subpart_at_time": "Powerplant",
      "title_at_amendment": "Fuel tank tests.",
      "text": "(a) Each fuel tank must be able to withstand the following pressures without failure or leakage: (1) For each conventional metal tank and nonmetallic tank with walls not supported by the airplane structure, a pressure of 3.5 p.s.i., or that pressure developed during maximum ultimate acceleration with a full tank, whichever is greater.\n(2) For each integral tank, the pressure developed during the maximum limit acceleration of the airplane with a full tank, with simultaneous application of the critical limit structural loads.\n(3) For each nonmetallic tank with walls supported by the airplane structure and constructed in an acceptable manner using acceptable basic tank material, and with actual or simulated support conditions, a pressure of 2 p.s.i. for the first tank of a specific design. The supporting structure must be designed for the critical loads occurring in the flight or landing strength conditions combined with the fuel pressure loads resulting from the corresponding accelerations. (b) Each fuel tank with large, unsupported, or unstiffened flat surfaces, whose failure or deformation could cause fuel leakage, must be able to withstand the following test without leakage, failure, or excessive deformation of the tank walls: (1) Each complete tank assembly and its support must be vibration tested while mounted to simulate the actual installation.\n(2) Except as specified in paragraph (b)(4) of this section, the tank assembly must be vibrated for 25 hours at a total displacement of not less than 1/32 of an inch (unless another displacement is substantiated) while 2/3 filled with water or other suitable test fluid.\n(3) The test frequency of vibration must be as follows: [(i) If no frequency of vibration resulting from any r.p.m. within the normal operating range of engine or propeller speeds is critical, the test frequency of vibration is: (A) The number of cycles per minute obtained by multiplying the maximum continuous propeller speed in r.p.m. by 0.9 for propeller-driven airplanes, and\n(B) For non-propeller driven airplanes the test frequency of vibration is 2,000 cycles per minute.] (ii) If only one frequency of vibration resulting from any r.p.m. within the normal operating range of engine or propeller speeds is critical, that frequency of vibration must be the test frequency.\n(iii) If more than one frequency of vibration resulting from any r.p.m. within the normal operating range of engine or propeller speeds is critical, the most critical of these frequencies must be the test frequency. (4) Under paragraph (b)(3)(ii) and (iii) of this section, the time of test must be adjusted to accomplish the same number of vibration cycles that would be accomplished in 25 hours at the frequency specified in paragraph (b)(3)(i) of this section.\n(5) During the test, the tank assembly must be rocked at a rate of 16 to 20 complete cycles per minute, through an angle of 15 degrees on either side of the horizontal (30 degrees total), about an axis parallel to the axis of the fuselage, for 25 hours. (c) Each integral tank using methods of construction and sealing not previously proven to be adequate by test data or service experience must be able to withstand the vibration test specified in paragraphs (b)(1) through (4) of this section.\n(d) Each tank with a nonmetallic liner must be subjected to the sloshing test outlined in paragraph (b)(5) of this section, with the fuel at room temperature. In addition, a specimen liner of the same basic construction as that to be used in the airplane must, when installed in a suitable test tank, withstand the sloshing test with fuel at a temperature of 110 \ufffdF. Notice of Proposed Rulemaking. Notice No. 94-19; Issued on 06/22/94. --> Link to eCFR --> NPRM ACTIONS: &nbsp; Notice of Proposed Rulemaking. Notice No. 94-19; Issued on 06/22/94. Final Rule. Docket No. 27804; Issued on 01/29/96. --> Link to eCFR --> FINAL RULE ACTIONS: &nbsp; Final Rule. Docket No. 27804; Issued on 01/29/96.",
      "federal_register_cite": "61 FR 5136",
      "source_url": "https://drs.faa.gov/browse/excelExternalWindow/6F168AEACD383E62852566870070AA7D.0001"
    }
  ],
  "subject_group": "Fuel System"
}
