{
  "authority": "FAA",
  "part": "23",
  "section": "1337",
  "current_subpart": "Equipment",
  "canonical_title": "Powerplant instruments installation.",
  "amendments": [
    {
      "designator": "23-51",
      "subpart_at_time": "Equipment",
      "title_at_amendment": "Powerplant instruments installation.",
      "text": "(a) Instruments and instrument lines. (1) Each powerplant and auxiliary power unit instrument line must meet the requirements of Sec. 23.993. (2) Each line carrying flammable fluids under pressure must-- (i) Have restricting orifices or other safety devices at the source of pressure to prevent the escape of excessive fluid if the line fails; and (ii) Be installed and located so that the escape of fluids would not create a hazard. (3) Each powerplant and auxiliary power unit instrument that utilizes flammable fluids must be installed and located so that the escape of fluid would not create a hazard. (b) Fuel quantity indicator. There must be a means to indicate to the flightcrew members the quantity of usable fuel in each tank during flight. An indicator calibrated in appropriate units and clearly marked to indicate those units must be used. In addition-- (1) Each fuel quantity indicator must be calibrated to read &quot;zero&quot; during level flight when the quantity of fuel remaining in the tank is equal to the unusable fuel supply determined under [Sec. 23.959(a);] (2) Each exposed sight gauge used as a fuel quantity indicator must be protected against damage; (3) Each sight gauge that forms a trap in which water can collect and freeze must have means to allow drainage on the ground; (4) There must be a means to indicate the amount of usable fuel in each tank when the airplane is on the ground (such as by a stick gauge); (5) Tanks with interconnected outlets and airspaces may be considered as one tank and need not have separate indicators; and (6) No fuel quantity indicator is required for an auxiliary tank that is used only to transfer fuel to other tanks if the relative size of the tank, the rate of fuel transfer, and operating instructions are adequate to-- (i) Guard against overflow; and (ii) Give the flight crewmembers prompt warning if transfer is not proceeding as planned. (c) Fuel flowmeter system. If a fuel flowmeter system is installed, each metering component must have a means to by-pass the fuel supply if malfunctioning of that component severely restricts fuel flow. (d) Oil quantity indicator. There must be a means to indicate the quantity of oil in each tank-- (1) On the ground (such as by a stick gauge); and (2) In flight, to the flight crewmembers, if there is an oil transfer system or a reserve oil supply system. (e) [Deleted.]",
      "federal_register_cite": "61 FR 5138",
      "source_url": "https://drs.faa.gov/browse/excelExternalWindow/81D761D6CE5213ED86256904006C9CAF.0001",
      "actions": [
        {
          "type": "nprm",
          "reference": "94-19",
          "issued_on": "1994-06-22",
          "source_url": null,
          "notes": null
        },
        {
          "type": "final_rule",
          "reference": "27804",
          "issued_on": "1996-01-29",
          "source_url": null,
          "notes": null
        }
      ]
    }
  ],
  "subject_group": "Instruments: Installation"
}
